[2025-10-28T21:26:45.245+0000] {taskinstance.py:1159} INFO - Dependencies all met for dep_context=non-requeueable deps ti=<TaskInstance: sodai_drinks_production_pipeline.train_model scheduled__2025-10-19T00:00:00+00:00 [queued]>
[2025-10-28T21:26:45.262+0000] {taskinstance.py:1159} INFO - Dependencies all met for dep_context=requeueable deps ti=<TaskInstance: sodai_drinks_production_pipeline.train_model scheduled__2025-10-19T00:00:00+00:00 [queued]>
[2025-10-28T21:26:45.262+0000] {taskinstance.py:1361} INFO - Starting attempt 1 of 2
[2025-10-28T21:26:45.289+0000] {taskinstance.py:1382} INFO - Executing <Task(PythonOperator): train_model> on 2025-10-19 00:00:00+00:00
[2025-10-28T21:26:45.331+0000] {standard_task_runner.py:57} INFO - Started process 584 to run task
[2025-10-28T21:26:45.359+0000] {standard_task_runner.py:84} INFO - Running: ['***', 'tasks', 'run', 'sodai_drinks_production_pipeline', 'train_model', 'scheduled__2025-10-19T00:00:00+00:00', '--job-id', '11', '--raw', '--subdir', 'DAGS_FOLDER/pipeline_productivo.py', '--cfg-path', '/tmp/tmpy7z4w989']
[2025-10-28T21:26:45.365+0000] {standard_task_runner.py:85} INFO - Job 11: Subtask train_model
[2025-10-28T21:26:45.465+0000] {task_command.py:416} INFO - Running <TaskInstance: sodai_drinks_production_pipeline.train_model scheduled__2025-10-19T00:00:00+00:00 [running]> on host ee70ee0df05e
[2025-10-28T21:26:45.602+0000] {taskinstance.py:1662} INFO - Exporting env vars: AIRFLOW_CTX_DAG_EMAIL='team@sodaidrinks.com' AIRFLOW_CTX_DAG_OWNER='sodai_drinks_team' AIRFLOW_CTX_DAG_ID='sodai_drinks_production_pipeline' AIRFLOW_CTX_TASK_ID='train_model' AIRFLOW_CTX_EXECUTION_DATE='2025-10-19T00:00:00+00:00' AIRFLOW_CTX_TRY_NUMBER='1' AIRFLOW_CTX_DAG_RUN_ID='scheduled__2025-10-19T00:00:00+00:00'
[2025-10-28T21:26:45.605+0000] {model_training.py:160} INFO - Iniciando entrenamiento del modelo...
[2025-10-28T21:26:45.977+0000] {model_training.py:175} INFO - Features: 19, Registros: 94587
[2025-10-28T21:26:45.987+0000] {model_training.py:176} INFO - Distribución de clases - 0: 0, 1: 94587
[2025-10-28T21:26:46.479+0000] {logging_mixin.py:154} WARNING - 2025/10/28 21:26:46 INFO mlflow.tracking.fluent: Experiment with name 'sodai_drinks_prediction' does not exist. Creating a new experiment.
[2025-10-28T21:26:48.856+0000] {logging_mixin.py:154} WARNING - 2025/10/28 21:26:48 WARNING mlflow.utils.git_utils: Failed to import Git (the Git executable is probably not on your PATH), so Git SHA is not available. Error: Failed to initialize: Bad git executable.
The git executable must be specified in one of the following ways:
    - be included in your $PATH
    - be set via $GIT_PYTHON_GIT_EXECUTABLE
    - explicitly set via git.refresh(<full-path-to-git-executable>)

All git commands will error until this is rectified.

This initial message can be silenced or aggravated in the future by setting the
$GIT_PYTHON_REFRESH environment variable. Use one of the following values:
    - quiet|q|silence|s|silent|none|n|0: for no message or exception
    - warn|w|warning|log|l|1: for a warning message (logging level CRITICAL, displayed by default)
    - error|e|exception|raise|r|2: for a raised exception

Example:
    export GIT_PYTHON_REFRESH=quiet
[2025-10-28T21:26:49.055+0000] {model_training.py:56} INFO - Iniciando optimización de hiperparámetros con 30 trials...
[2025-10-28T21:26:49.081+0000] {logging_mixin.py:154} WARNING -   0%|          | 0/30 [00:00<?, ?it/s]
[2025-10-28T21:26:50.852+0000] {logging_mixin.py:154} WARNING -                                       
[2025-10-28T21:26:50.854+0000] {logging_mixin.py:154} WARNING - 
[2025-10-28T21:26:50.855+0000] {logging_mixin.py:154} INFO - [I 2025-10-28 21:26:50,850] Trial 0 finished with value: 1.0 and parameters: {'model': 'random_forest', 'n_estimators': 192, 'max_depth': 20, 'min_samples_split': 20, 'min_samples_leaf': 1}. Best is trial 0 with value: 1.0.
[2025-10-28T21:26:50.855+0000] {logging_mixin.py:154} WARNING -   0%|          | 0/30 [00:01<?, ?it/s]
[2025-10-28T21:26:50.856+0000] {logging_mixin.py:154} WARNING - Best trial: 0. Best value: 1:   0%|          | 0/30 [00:01<?, ?it/s]
[2025-10-28T21:26:50.856+0000] {logging_mixin.py:154} WARNING - Best trial: 0. Best value: 1:   3%|3         | 1/30 [00:01<00:51,  1.77s/it]
[2025-10-28T21:26:50.905+0000] {logging_mixin.py:154} WARNING -                                                                             
[2025-10-28T21:26:50.905+0000] {logging_mixin.py:154} WARNING - 
[2025-10-28T21:26:50.905+0000] {logging_mixin.py:154} INFO - [W 2025-10-28 21:26:50,898] Trial 1 failed with parameters: {'model': 'gradient_boosting', 'n_estimators': 59, 'max_depth': 7, 'learning_rate': 0.1503140957680337, 'subsample': 0.7177456151639611} because of the following error: ValueError('y contains 1 class after sample_weight trimmed classes with zero weights, while a minimum of 2 classes are required.').
Traceback (most recent call last):
  File "/home/***/.local/lib/python3.10/site-packages/optuna/study/_optimize.py", line 200, in _run_trial
    value_or_values = func(trial)
  File "/opt/***/dags/tasks/model_training.py", line 94, in objective
    model.fit(X_train, y_train)
  File "/home/***/.local/lib/python3.10/site-packages/sklearn/base.py", line 1152, in wrapper
    return fit_method(estimator, *args, **kwargs)
  File "/home/***/.local/lib/python3.10/site-packages/sklearn/ensemble/_gb.py", line 427, in fit
    y = self._validate_y(y, sample_weight)
  File "/home/***/.local/lib/python3.10/site-packages/sklearn/ensemble/_gb.py", line 1217, in _validate_y
    raise ValueError(
ValueError: y contains 1 class after sample_weight trimmed classes with zero weights, while a minimum of 2 classes are required.
[2025-10-28T21:26:50.906+0000] {logging_mixin.py:154} WARNING - Best trial: 0. Best value: 1:   3%|3         | 1/30 [00:01<00:51,  1.77s/it]
[2025-10-28T21:26:50.906+0000] {logging_mixin.py:154} WARNING -                                                                             
[2025-10-28T21:26:50.906+0000] {logging_mixin.py:154} WARNING - 
[2025-10-28T21:26:50.906+0000] {logging_mixin.py:154} INFO - [W 2025-10-28 21:26:50,906] Trial 1 failed with value None.
[2025-10-28T21:26:50.906+0000] {logging_mixin.py:154} WARNING - Best trial: 0. Best value: 1:   3%|3         | 1/30 [00:01<00:51,  1.77s/it]
[2025-10-28T21:26:50.906+0000] {logging_mixin.py:154} WARNING - Best trial: 0. Best value: 1:   3%|3         | 1/30 [00:01<00:52,  1.82s/it]
[2025-10-28T21:26:50.907+0000] {taskinstance.py:1937} ERROR - Task failed with exception
Traceback (most recent call last):
  File "/home/airflow/.local/lib/python3.10/site-packages/airflow/operators/python.py", line 192, in execute
    return_value = self.execute_callable()
  File "/home/airflow/.local/lib/python3.10/site-packages/airflow/operators/python.py", line 209, in execute_callable
    return self.python_callable(*self.op_args, **self.op_kwargs)
  File "/opt/airflow/dags/tasks/model_training.py", line 189, in train_model
    best_params, study = optimize_hyperparameters(X_train, y_train, X_val, y_val, n_trials=30)
  File "/opt/airflow/dags/tasks/model_training.py", line 102, in optimize_hyperparameters
    study.optimize(objective, n_trials=n_trials, show_progress_bar=True)
  File "/home/airflow/.local/lib/python3.10/site-packages/optuna/study/study.py", line 451, in optimize
    _optimize(
  File "/home/airflow/.local/lib/python3.10/site-packages/optuna/study/_optimize.py", line 66, in _optimize
    _optimize_sequential(
  File "/home/airflow/.local/lib/python3.10/site-packages/optuna/study/_optimize.py", line 163, in _optimize_sequential
    frozen_trial = _run_trial(study, func, catch)
  File "/home/airflow/.local/lib/python3.10/site-packages/optuna/study/_optimize.py", line 251, in _run_trial
    raise func_err
  File "/home/airflow/.local/lib/python3.10/site-packages/optuna/study/_optimize.py", line 200, in _run_trial
    value_or_values = func(trial)
  File "/opt/airflow/dags/tasks/model_training.py", line 94, in objective
    model.fit(X_train, y_train)
  File "/home/airflow/.local/lib/python3.10/site-packages/sklearn/base.py", line 1152, in wrapper
    return fit_method(estimator, *args, **kwargs)
  File "/home/airflow/.local/lib/python3.10/site-packages/sklearn/ensemble/_gb.py", line 427, in fit
    y = self._validate_y(y, sample_weight)
  File "/home/airflow/.local/lib/python3.10/site-packages/sklearn/ensemble/_gb.py", line 1217, in _validate_y
    raise ValueError(
ValueError: y contains 1 class after sample_weight trimmed classes with zero weights, while a minimum of 2 classes are required.
[2025-10-28T21:26:50.928+0000] {taskinstance.py:1400} INFO - Marking task as UP_FOR_RETRY. dag_id=sodai_drinks_production_pipeline, task_id=train_model, execution_date=20251019T000000, start_date=20251028T212645, end_date=20251028T212650
[2025-10-28T21:26:50.946+0000] {standard_task_runner.py:104} ERROR - Failed to execute job 11 for task train_model (y contains 1 class after sample_weight trimmed classes with zero weights, while a minimum of 2 classes are required.; 584)
[2025-10-28T21:26:50.984+0000] {local_task_job_runner.py:228} INFO - Task exited with return code 1
[2025-10-28T21:26:51.031+0000] {taskinstance.py:2778} INFO - 0 downstream tasks scheduled from follow-on schedule check
[2025-10-28T23:45:22.601+0000] {taskinstance.py:1159} INFO - Dependencies all met for dep_context=non-requeueable deps ti=<TaskInstance: sodai_drinks_production_pipeline.train_model scheduled__2025-10-19T00:00:00+00:00 [queued]>
[2025-10-28T23:45:22.606+0000] {taskinstance.py:1159} INFO - Dependencies all met for dep_context=requeueable deps ti=<TaskInstance: sodai_drinks_production_pipeline.train_model scheduled__2025-10-19T00:00:00+00:00 [queued]>
[2025-10-28T23:45:22.606+0000] {taskinstance.py:1361} INFO - Starting attempt 1 of 2
[2025-10-28T23:45:22.614+0000] {taskinstance.py:1382} INFO - Executing <Task(PythonOperator): train_model> on 2025-10-19 00:00:00+00:00
[2025-10-28T23:45:22.632+0000] {standard_task_runner.py:57} INFO - Started process 624 to run task
[2025-10-28T23:45:22.642+0000] {standard_task_runner.py:84} INFO - Running: ['***', 'tasks', 'run', 'sodai_drinks_production_pipeline', 'train_model', 'scheduled__2025-10-19T00:00:00+00:00', '--job-id', '111', '--raw', '--subdir', 'DAGS_FOLDER/pipeline_productivo.py', '--cfg-path', '/tmp/tmpqb8edei9']
[2025-10-28T23:45:22.645+0000] {standard_task_runner.py:85} INFO - Job 111: Subtask train_model
[2025-10-28T23:45:22.685+0000] {task_command.py:416} INFO - Running <TaskInstance: sodai_drinks_production_pipeline.train_model scheduled__2025-10-19T00:00:00+00:00 [running]> on host ee70ee0df05e
[2025-10-28T23:45:22.733+0000] {taskinstance.py:1662} INFO - Exporting env vars: AIRFLOW_CTX_DAG_EMAIL='team@sodaidrinks.com' AIRFLOW_CTX_DAG_OWNER='sodai_drinks_team' AIRFLOW_CTX_DAG_ID='sodai_drinks_production_pipeline' AIRFLOW_CTX_TASK_ID='train_model' AIRFLOW_CTX_EXECUTION_DATE='2025-10-19T00:00:00+00:00' AIRFLOW_CTX_TRY_NUMBER='1' AIRFLOW_CTX_DAG_RUN_ID='scheduled__2025-10-19T00:00:00+00:00'
[2025-10-28T23:45:22.734+0000] {model_training.py:172} INFO - Iniciando entrenamiento del modelo...
[2025-10-28T23:45:23.032+0000] {model_training.py:187} INFO - Features: 16, Registros: 619380
[2025-10-28T23:45:23.039+0000] {model_training.py:188} INFO - Distribución de clases - 0: 412920, 1: 206460
[2025-10-28T23:45:23.730+0000] {logging_mixin.py:154} WARNING - 2025/10/28 23:45:23 WARNING mlflow.utils.git_utils: Failed to import Git (the Git executable is probably not on your PATH), so Git SHA is not available. Error: Failed to initialize: Bad git executable.
The git executable must be specified in one of the following ways:
    - be included in your $PATH
    - be set via $GIT_PYTHON_GIT_EXECUTABLE
    - explicitly set via git.refresh(<full-path-to-git-executable>)

All git commands will error until this is rectified.

This initial message can be silenced or aggravated in the future by setting the
$GIT_PYTHON_REFRESH environment variable. Use one of the following values:
    - quiet|q|silence|s|silent|none|n|0: for no message or exception
    - warn|w|warning|log|l|1: for a warning message (logging level CRITICAL, displayed by default)
    - error|e|exception|raise|r|2: for a raised exception

Example:
    export GIT_PYTHON_REFRESH=quiet
[2025-10-28T23:45:23.750+0000] {model_training.py:56} INFO - Iniciando optimización de hiperparámetros con 30 trials...
[2025-10-28T23:45:23.755+0000] {logging_mixin.py:154} WARNING -   0%|          | 0/30 [00:00<?, ?it/s]
[2025-10-28T23:45:24.647+0000] {model_training.py:107} WARNING - Error al entrenar modelo gradient_boosting: could not convert string to float: 'Brand 7'
[2025-10-28T23:45:24.662+0000] {logging_mixin.py:154} WARNING -                                       
[2025-10-28T23:45:24.662+0000] {logging_mixin.py:154} WARNING - 
[2025-10-28T23:45:24.663+0000] {logging_mixin.py:154} INFO - [I 2025-10-28 23:45:24,660] Trial 0 pruned. 
[2025-10-28T23:45:24.663+0000] {logging_mixin.py:154} WARNING -   0%|          | 0/30 [00:00<?, ?it/s]
[2025-10-28T23:45:24.667+0000] {logging_mixin.py:154} WARNING -   3%|3         | 1/30 [00:00<00:26,  1.10it/s]
[2025-10-28T23:45:24.725+0000] {model_training.py:107} WARNING - Error al entrenar modelo xgboost: DataFrame.dtypes for data must be int, float, bool or category. When categorical type is supplied, The experimental DMatrix parameter`enable_categorical` must be set to `True`.  Invalid columns:brand: object
[2025-10-28T23:45:24.726+0000] {logging_mixin.py:154} WARNING -                                               
[2025-10-28T23:45:24.726+0000] {logging_mixin.py:154} WARNING - 
[2025-10-28T23:45:24.726+0000] {logging_mixin.py:154} INFO - [I 2025-10-28 23:45:24,726] Trial 1 pruned. 
[2025-10-28T23:45:24.726+0000] {logging_mixin.py:154} WARNING -   3%|3         | 1/30 [00:00<00:26,  1.10it/s]
[2025-10-28T23:45:25.324+0000] {model_training.py:107} WARNING - Error al entrenar modelo random_forest: could not convert string to float: 'Brand 7'
[2025-10-28T23:45:25.328+0000] {logging_mixin.py:154} WARNING -                                               
[2025-10-28T23:45:25.328+0000] {logging_mixin.py:154} WARNING - 
[2025-10-28T23:45:25.328+0000] {logging_mixin.py:154} INFO - [I 2025-10-28 23:45:25,327] Trial 2 pruned. 
[2025-10-28T23:45:25.328+0000] {logging_mixin.py:154} WARNING -   7%|6         | 2/30 [00:01<00:25,  1.10it/s]
[2025-10-28T23:45:25.329+0000] {logging_mixin.py:154} WARNING -  10%|#         | 3/30 [00:01<00:12,  2.08it/s]
[2025-10-28T23:45:25.778+0000] {model_training.py:107} WARNING - Error al entrenar modelo gradient_boosting: could not convert string to float: 'Brand 7'
[2025-10-28T23:45:26.420+0000] {logging_mixin.py:154} WARNING -                                               
[2025-10-28T23:45:26.423+0000] {logging_mixin.py:154} WARNING - 
[2025-10-28T23:45:26.423+0000] {logging_mixin.py:154} INFO - [I 2025-10-28 23:45:25,779] Trial 3 pruned. 
[2025-10-28T23:45:26.424+0000] {logging_mixin.py:154} WARNING -  10%|#         | 3/30 [00:02<00:12,  2.08it/s]
[2025-10-28T23:45:26.425+0000] {logging_mixin.py:154} WARNING -  13%|#3        | 4/30 [00:02<00:18,  1.44it/s]
[2025-10-28T23:45:26.805+0000] {model_training.py:107} WARNING - Error al entrenar modelo gradient_boosting: could not convert string to float: 'Brand 7'
[2025-10-28T23:45:26.807+0000] {logging_mixin.py:154} WARNING -                                               
[2025-10-28T23:45:26.807+0000] {logging_mixin.py:154} WARNING - 
[2025-10-28T23:45:26.807+0000] {logging_mixin.py:154} INFO - [I 2025-10-28 23:45:26,807] Trial 4 pruned. 
[2025-10-28T23:45:26.807+0000] {logging_mixin.py:154} WARNING -  13%|#3        | 4/30 [00:03<00:18,  1.44it/s]
[2025-10-28T23:45:26.807+0000] {logging_mixin.py:154} WARNING -  17%|#6        | 5/30 [00:03<00:14,  1.69it/s]
[2025-10-28T23:45:26.825+0000] {model_training.py:107} WARNING - Error al entrenar modelo xgboost: DataFrame.dtypes for data must be int, float, bool or category. When categorical type is supplied, The experimental DMatrix parameter`enable_categorical` must be set to `True`.  Invalid columns:brand: object
[2025-10-28T23:45:26.826+0000] {logging_mixin.py:154} WARNING -                                               
[2025-10-28T23:45:26.826+0000] {logging_mixin.py:154} WARNING - 
[2025-10-28T23:45:26.826+0000] {logging_mixin.py:154} INFO - [I 2025-10-28 23:45:26,826] Trial 5 pruned. 
[2025-10-28T23:45:26.826+0000] {logging_mixin.py:154} WARNING -  17%|#6        | 5/30 [00:03<00:14,  1.69it/s]
[2025-10-28T23:45:26.840+0000] {model_training.py:107} WARNING - Error al entrenar modelo xgboost: DataFrame.dtypes for data must be int, float, bool or category. When categorical type is supplied, The experimental DMatrix parameter`enable_categorical` must be set to `True`.  Invalid columns:brand: object
[2025-10-28T23:45:26.840+0000] {logging_mixin.py:154} WARNING -                                               
[2025-10-28T23:45:26.840+0000] {logging_mixin.py:154} WARNING - 
[2025-10-28T23:45:26.840+0000] {logging_mixin.py:154} INFO - [I 2025-10-28 23:45:26,840] Trial 6 pruned. 
[2025-10-28T23:45:26.840+0000] {logging_mixin.py:154} WARNING -  20%|##        | 6/30 [00:03<00:14,  1.69it/s]
[2025-10-28T23:45:27.087+0000] {model_training.py:107} WARNING - Error al entrenar modelo random_forest: could not convert string to float: 'Brand 7'
[2025-10-28T23:45:27.088+0000] {logging_mixin.py:154} WARNING -                                               
[2025-10-28T23:45:27.088+0000] {logging_mixin.py:154} WARNING - 
[2025-10-28T23:45:27.088+0000] {logging_mixin.py:154} INFO - [I 2025-10-28 23:45:27,088] Trial 7 pruned. 
[2025-10-28T23:45:27.088+0000] {logging_mixin.py:154} WARNING -  23%|##3       | 7/30 [00:03<00:13,  1.69it/s]
[2025-10-28T23:45:27.088+0000] {logging_mixin.py:154} WARNING -  27%|##6       | 8/30 [00:03<00:06,  3.34it/s]
[2025-10-28T23:45:27.103+0000] {model_training.py:107} WARNING - Error al entrenar modelo xgboost: DataFrame.dtypes for data must be int, float, bool or category. When categorical type is supplied, The experimental DMatrix parameter`enable_categorical` must be set to `True`.  Invalid columns:brand: object
[2025-10-28T23:45:27.103+0000] {logging_mixin.py:154} WARNING -                                               
[2025-10-28T23:45:27.103+0000] {logging_mixin.py:154} WARNING - 
[2025-10-28T23:45:27.103+0000] {logging_mixin.py:154} INFO - [I 2025-10-28 23:45:27,103] Trial 8 pruned. 
[2025-10-28T23:45:27.103+0000] {logging_mixin.py:154} WARNING -  27%|##6       | 8/30 [00:03<00:06,  3.34it/s]
[2025-10-28T23:45:27.595+0000] {model_training.py:107} WARNING - Error al entrenar modelo gradient_boosting: could not convert string to float: 'Brand 7'
[2025-10-28T23:45:27.604+0000] {logging_mixin.py:154} WARNING -                                               
[2025-10-28T23:45:28.132+0000] {logging_mixin.py:154} WARNING - 
[2025-10-28T23:45:28.132+0000] {logging_mixin.py:154} INFO - [I 2025-10-28 23:45:27,602] Trial 9 pruned. 
[2025-10-28T23:45:28.132+0000] {logging_mixin.py:154} WARNING -  30%|###       | 9/30 [00:04<00:06,  3.34it/s]
[2025-10-28T23:45:28.133+0000] {logging_mixin.py:154} WARNING -  33%|###3      | 10/30 [00:04<00:07,  2.64it/s]
[2025-10-28T23:45:28.506+0000] {model_training.py:107} WARNING - Error al entrenar modelo gradient_boosting: could not convert string to float: 'Brand 7'
[2025-10-28T23:45:28.508+0000] {logging_mixin.py:154} WARNING -                                                
[2025-10-28T23:45:28.508+0000] {logging_mixin.py:154} WARNING - 
[2025-10-28T23:45:28.508+0000] {logging_mixin.py:154} INFO - [I 2025-10-28 23:45:28,507] Trial 10 pruned. 
[2025-10-28T23:45:28.508+0000] {logging_mixin.py:154} WARNING -  33%|###3      | 10/30 [00:04<00:07,  2.64it/s]
[2025-10-28T23:45:28.508+0000] {logging_mixin.py:154} WARNING -  37%|###6      | 11/30 [00:04<00:07,  2.64it/s]
[2025-10-28T23:45:28.534+0000] {model_training.py:107} WARNING - Error al entrenar modelo xgboost: DataFrame.dtypes for data must be int, float, bool or category. When categorical type is supplied, The experimental DMatrix parameter`enable_categorical` must be set to `True`.  Invalid columns:brand: object
[2025-10-28T23:45:28.534+0000] {logging_mixin.py:154} WARNING -                                                
[2025-10-28T23:45:28.576+0000] {logging_mixin.py:154} WARNING - 
[2025-10-28T23:45:28.576+0000] {logging_mixin.py:154} INFO - [I 2025-10-28 23:45:28,534] Trial 11 pruned. 
[2025-10-28T23:45:28.577+0000] {logging_mixin.py:154} WARNING -  37%|###6      | 11/30 [00:04<00:07,  2.64it/s]
[2025-10-28T23:45:28.791+0000] {model_training.py:107} WARNING - Error al entrenar modelo gradient_boosting: could not convert string to float: 'Brand 7'
[2025-10-28T23:45:28.792+0000] {logging_mixin.py:154} WARNING -                                                
[2025-10-28T23:45:28.792+0000] {logging_mixin.py:154} WARNING - 
[2025-10-28T23:45:28.792+0000] {logging_mixin.py:154} INFO - [I 2025-10-28 23:45:28,792] Trial 12 pruned. 
[2025-10-28T23:45:28.792+0000] {logging_mixin.py:154} WARNING -  40%|####      | 12/30 [00:05<00:06,  2.64it/s]
[2025-10-28T23:45:28.792+0000] {logging_mixin.py:154} WARNING -  43%|####3     | 13/30 [00:05<00:04,  3.43it/s]
[2025-10-28T23:45:28.815+0000] {model_training.py:107} WARNING - Error al entrenar modelo xgboost: DataFrame.dtypes for data must be int, float, bool or category. When categorical type is supplied, The experimental DMatrix parameter`enable_categorical` must be set to `True`.  Invalid columns:brand: object
[2025-10-28T23:45:28.816+0000] {logging_mixin.py:154} WARNING -                                                
[2025-10-28T23:45:28.816+0000] {logging_mixin.py:154} WARNING - 
