[2025-10-29T01:16:29.809+0000] {logging_mixin.py:154} INFO - [I 2025-10-29 01:16:29,801] Trial 13 finished with value: 0.7680705380789354 and parameters: {'model': 'xgboost', 'n_estimators': 205, 'max_depth': 10, 'learning_rate': 0.08706322323490862, 'subsample': 0.6055655749116985, 'colsample_bytree': 0.6020163534503469}. Best is trial 8 with value: 0.7923824701195219.
[2025-10-29T01:16:29.809+0000] {logging_mixin.py:154} WARNING - Best trial: 8. Best value: 0.792382:  43%|####3     | 13/30 [15:50<20:56, 73.91s/it]
[2025-10-29T01:16:29.810+0000] {logging_mixin.py:154} WARNING - Best trial: 8. Best value: 0.792382:  43%|####3     | 13/30 [15:50<20:56, 73.91s/it]
[2025-10-29T01:16:29.810+0000] {logging_mixin.py:154} WARNING - Best trial: 8. Best value: 0.792382:  47%|####6     | 14/30 [15:50<14:36, 54.79s/it]
[2025-10-29T01:16:40.461+0000] {logging_mixin.py:154} WARNING -                                                                                     
[2025-10-29T01:16:40.463+0000] {logging_mixin.py:154} WARNING - 
[2025-10-29T01:16:40.463+0000] {logging_mixin.py:154} INFO - [I 2025-10-29 01:16:40,458] Trial 14 finished with value: 0.7650782315133415 and parameters: {'model': 'xgboost', 'n_estimators': 188, 'max_depth': 10, 'learning_rate': 0.07237125983507839, 'subsample': 0.602852865023819, 'colsample_bytree': 0.77482029028904}. Best is trial 8 with value: 0.7923824701195219.
[2025-10-29T01:16:40.464+0000] {logging_mixin.py:154} WARNING - Best trial: 8. Best value: 0.792382:  47%|####6     | 14/30 [16:01<14:36, 54.79s/it]
[2025-10-29T01:16:40.464+0000] {logging_mixin.py:154} WARNING - Best trial: 8. Best value: 0.792382:  47%|####6     | 14/30 [16:01<14:36, 54.79s/it]
[2025-10-29T01:16:40.465+0000] {logging_mixin.py:154} WARNING - Best trial: 8. Best value: 0.792382:  50%|#####     | 15/30 [16:01<10:22, 41.48s/it]
[2025-10-29T01:21:08.363+0000] {logging_mixin.py:154} WARNING -                                                                                     
[2025-10-29T01:21:08.365+0000] {logging_mixin.py:154} WARNING - 
[2025-10-29T01:21:08.365+0000] {logging_mixin.py:154} INFO - [I 2025-10-29 01:21:08,360] Trial 15 finished with value: 0.7811655731377847 and parameters: {'model': 'gradient_boosting', 'n_estimators': 295, 'max_depth': 9, 'learning_rate': 0.07054269204100745, 'subsample': 0.6953823422929369}. Best is trial 8 with value: 0.7923824701195219.
[2025-10-29T01:21:08.366+0000] {logging_mixin.py:154} WARNING - Best trial: 8. Best value: 0.792382:  50%|#####     | 15/30 [20:29<10:22, 41.48s/it]
[2025-10-29T01:21:08.366+0000] {logging_mixin.py:154} WARNING - Best trial: 8. Best value: 0.792382:  50%|#####     | 15/30 [20:29<10:22, 41.48s/it]
[2025-10-29T01:21:08.367+0000] {logging_mixin.py:154} WARNING - Best trial: 8. Best value: 0.792382:  53%|#####3    | 16/30 [20:29<25:34, 109.64s/it]
[2025-10-29T01:24:22.922+0000] {logging_mixin.py:154} WARNING -                                                                                      
[2025-10-29T01:24:22.924+0000] {logging_mixin.py:154} WARNING - 
[2025-10-29T01:24:22.924+0000] {logging_mixin.py:154} INFO - [I 2025-10-29 01:24:22,919] Trial 16 finished with value: 0.7666156501351394 and parameters: {'model': 'gradient_boosting', 'n_estimators': 297, 'max_depth': 8, 'learning_rate': 0.059907357229293315, 'subsample': 0.7058738343306528}. Best is trial 8 with value: 0.7923824701195219.
[2025-10-29T01:24:22.926+0000] {logging_mixin.py:154} WARNING - Best trial: 8. Best value: 0.792382:  53%|#####3    | 16/30 [23:43<25:34, 109.64s/it]
[2025-10-29T01:24:22.928+0000] {logging_mixin.py:154} WARNING - Best trial: 8. Best value: 0.792382:  53%|#####3    | 16/30 [23:43<25:34, 109.64s/it]
[2025-10-29T01:24:22.929+0000] {logging_mixin.py:154} WARNING - Best trial: 8. Best value: 0.792382:  57%|#####6    | 17/30 [23:43<29:17, 135.17s/it]
[2025-10-29T01:28:06.425+0000] {logging_mixin.py:154} WARNING -                                                                                      
[2025-10-29T01:28:06.426+0000] {logging_mixin.py:154} WARNING - 
[2025-10-29T01:28:06.426+0000] {logging_mixin.py:154} INFO - [I 2025-10-29 01:28:06,418] Trial 17 finished with value: 0.7405837491447358 and parameters: {'model': 'gradient_boosting', 'n_estimators': 259, 'max_depth': 9, 'learning_rate': 0.02601148136688608, 'subsample': 0.7186559981339827}. Best is trial 8 with value: 0.7923824701195219.
[2025-10-29T01:28:06.427+0000] {logging_mixin.py:154} WARNING - Best trial: 8. Best value: 0.792382:  57%|#####6    | 17/30 [27:27<29:17, 135.17s/it]
[2025-10-29T01:28:06.427+0000] {logging_mixin.py:154} WARNING - Best trial: 8. Best value: 0.792382:  57%|#####6    | 17/30 [27:27<29:17, 135.17s/it]
[2025-10-29T01:28:06.427+0000] {logging_mixin.py:154} WARNING - Best trial: 8. Best value: 0.792382:  60%|######    | 18/30 [27:27<32:20, 161.71s/it]
[2025-10-29T01:30:26.075+0000] {logging_mixin.py:154} WARNING -                                                                                      
[2025-10-29T01:30:26.078+0000] {logging_mixin.py:154} WARNING - 
[2025-10-29T01:30:26.079+0000] {logging_mixin.py:154} INFO - [I 2025-10-29 01:30:26,074] Trial 18 finished with value: 0.7644680642952627 and parameters: {'model': 'gradient_boosting', 'n_estimators': 267, 'max_depth': 7, 'learning_rate': 0.09585797043197301, 'subsample': 0.6675227248273596}. Best is trial 8 with value: 0.7923824701195219.
[2025-10-29T01:30:26.079+0000] {logging_mixin.py:154} WARNING - Best trial: 8. Best value: 0.792382:  60%|######    | 18/30 [29:47<32:20, 161.71s/it]
[2025-10-29T01:30:26.079+0000] {logging_mixin.py:154} WARNING - Best trial: 8. Best value: 0.792382:  60%|######    | 18/30 [29:47<32:20, 161.71s/it]
[2025-10-29T01:30:26.080+0000] {logging_mixin.py:154} WARNING - Best trial: 8. Best value: 0.792382:  63%|######3   | 19/30 [29:47<28:25, 155.09s/it]
[2025-10-29T01:35:14.655+0000] {logging_mixin.py:154} WARNING -                                                                                      
[2025-10-29T01:35:14.659+0000] {logging_mixin.py:154} WARNING - 
[2025-10-29T01:35:14.659+0000] {logging_mixin.py:154} INFO - [I 2025-10-29 01:35:14,648] Trial 19 finished with value: 0.7970500727986327 and parameters: {'model': 'gradient_boosting', 'n_estimators': 282, 'max_depth': 9, 'learning_rate': 0.1691827341816251, 'subsample': 0.862137930783526}. Best is trial 19 with value: 0.7970500727986327.
[2025-10-29T01:35:14.661+0000] {logging_mixin.py:154} WARNING - Best trial: 8. Best value: 0.792382:  63%|######3   | 19/30 [34:35<28:25, 155.09s/it]
[2025-10-29T01:35:14.663+0000] {logging_mixin.py:154} WARNING - Best trial: 19. Best value: 0.79705:  63%|######3   | 19/30 [34:35<28:25, 155.09s/it]
[2025-10-29T01:35:14.663+0000] {logging_mixin.py:154} WARNING - Best trial: 19. Best value: 0.79705:  67%|######6   | 20/30 [34:35<32:31, 195.17s/it]
[2025-10-29T01:37:46.524+0000] {logging_mixin.py:154} WARNING -                                                                                      
[2025-10-29T01:37:46.526+0000] {logging_mixin.py:154} WARNING - 
[2025-10-29T01:37:46.527+0000] {logging_mixin.py:154} INFO - [I 2025-10-29 01:37:46,522] Trial 20 finished with value: 0.7759664948453607 and parameters: {'model': 'gradient_boosting', 'n_estimators': 241, 'max_depth': 7, 'learning_rate': 0.17043615577369484, 'subsample': 0.8506275241475962}. Best is trial 19 with value: 0.7970500727986327.
[2025-10-29T01:37:46.527+0000] {logging_mixin.py:154} WARNING - Best trial: 19. Best value: 0.79705:  67%|######6   | 20/30 [37:07<32:31, 195.17s/it]
[2025-10-29T01:37:46.528+0000] {logging_mixin.py:154} WARNING - Best trial: 19. Best value: 0.79705:  67%|######6   | 20/30 [37:07<32:31, 195.17s/it]
[2025-10-29T01:37:46.528+0000] {logging_mixin.py:154} WARNING - Best trial: 19. Best value: 0.79705:  70%|#######   | 21/30 [37:07<27:19, 182.17s/it]
[2025-10-29T01:42:11.472+0000] {logging_mixin.py:154} WARNING -                                                                                      
[2025-10-29T01:42:11.474+0000] {logging_mixin.py:154} WARNING - 
[2025-10-29T01:42:11.474+0000] {logging_mixin.py:154} INFO - [I 2025-10-29 01:42:11,466] Trial 21 finished with value: 0.7932217387161326 and parameters: {'model': 'gradient_boosting', 'n_estimators': 280, 'max_depth': 9, 'learning_rate': 0.13026023421412558, 'subsample': 0.8581570363543255}. Best is trial 19 with value: 0.7970500727986327.
[2025-10-29T01:42:11.475+0000] {logging_mixin.py:154} WARNING - Best trial: 19. Best value: 0.79705:  70%|#######   | 21/30 [41:32<27:19, 182.17s/it]
[2025-10-29T01:42:11.475+0000] {logging_mixin.py:154} WARNING - Best trial: 19. Best value: 0.79705:  70%|#######   | 21/30 [41:32<27:19, 182.17s/it]
[2025-10-29T01:42:11.475+0000] {logging_mixin.py:154} WARNING - Best trial: 19. Best value: 0.79705:  73%|#######3  | 22/30 [41:32<27:36, 207.01s/it]
[2025-10-29T01:46:25.762+0000] {logging_mixin.py:154} WARNING -                                                                                      
[2025-10-29T01:46:25.770+0000] {logging_mixin.py:154} WARNING - 
[2025-10-29T01:46:25.771+0000] {logging_mixin.py:154} INFO - [I 2025-10-29 01:46:25,758] Trial 22 finished with value: 0.7933689703449155 and parameters: {'model': 'gradient_boosting', 'n_estimators': 268, 'max_depth': 9, 'learning_rate': 0.14219561353119303, 'subsample': 0.8473103222457453}. Best is trial 19 with value: 0.7970500727986327.
[2025-10-29T01:46:25.772+0000] {logging_mixin.py:154} WARNING - Best trial: 19. Best value: 0.79705:  73%|#######3  | 22/30 [45:46<27:36, 207.01s/it]
[2025-10-29T01:46:25.772+0000] {logging_mixin.py:154} WARNING - Best trial: 19. Best value: 0.79705:  73%|#######3  | 22/30 [45:46<27:36, 207.01s/it]
[2025-10-29T01:46:25.772+0000] {logging_mixin.py:154} WARNING - Best trial: 19. Best value: 0.79705:  77%|#######6  | 23/30 [45:46<25:48, 221.20s/it]
[2025-10-29T01:50:50.078+0000] {logging_mixin.py:154} WARNING -                                                                                      
[2025-10-29T01:50:50.086+0000] {logging_mixin.py:154} WARNING - 
[2025-10-29T01:50:50.086+0000] {logging_mixin.py:154} INFO - [I 2025-10-29 01:50:50,071] Trial 23 finished with value: 0.7972224858435355 and parameters: {'model': 'gradient_boosting', 'n_estimators': 271, 'max_depth': 9, 'learning_rate': 0.18453007426617202, 'subsample': 0.8572838286849552}. Best is trial 23 with value: 0.7972224858435355.
[2025-10-29T01:50:50.088+0000] {logging_mixin.py:154} WARNING - Best trial: 19. Best value: 0.79705:  77%|#######6  | 23/30 [50:11<25:48, 221.20s/it]
[2025-10-29T01:50:50.088+0000] {logging_mixin.py:154} WARNING - Best trial: 23. Best value: 0.797222:  77%|#######6  | 23/30 [50:11<25:48, 221.20s/it]
[2025-10-29T01:50:50.088+0000] {logging_mixin.py:154} WARNING - Best trial: 23. Best value: 0.797222:  80%|########  | 24/30 [50:11<23:24, 234.14s/it]
[2025-10-29T01:54:16.113+0000] {logging_mixin.py:154} WARNING -                                                                                       
[2025-10-29T01:54:16.115+0000] {logging_mixin.py:154} WARNING - 
[2025-10-29T01:54:16.115+0000] {logging_mixin.py:154} INFO - [I 2025-10-29 01:54:16,110] Trial 24 finished with value: 0.7899063276620149 and parameters: {'model': 'gradient_boosting', 'n_estimators': 276, 'max_depth': 8, 'learning_rate': 0.17928159860444262, 'subsample': 0.8673385607659366}. Best is trial 23 with value: 0.7972224858435355.
[2025-10-29T01:54:16.116+0000] {logging_mixin.py:154} WARNING - Best trial: 23. Best value: 0.797222:  80%|########  | 24/30 [53:37<23:24, 234.14s/it]
[2025-10-29T01:54:16.116+0000] {logging_mixin.py:154} WARNING - Best trial: 23. Best value: 0.797222:  80%|########  | 24/30 [53:37<23:24, 234.14s/it]
[2025-10-29T01:54:16.117+0000] {logging_mixin.py:154} WARNING - Best trial: 23. Best value: 0.797222:  83%|########3 | 25/30 [53:37<18:48, 225.70s/it]
[2025-10-29T01:54:57.835+0000] {logging_mixin.py:154} WARNING -                                                                                       
[2025-10-29T01:54:57.839+0000] {logging_mixin.py:154} WARNING - 
[2025-10-29T01:54:57.839+0000] {logging_mixin.py:154} INFO - [I 2025-10-29 01:54:57,833] Trial 25 finished with value: 0.6970525883881555 and parameters: {'model': 'random_forest', 'n_estimators': 233, 'max_depth': 13, 'min_samples_split': 3, 'min_samples_leaf': 10}. Best is trial 23 with value: 0.7972224858435355.
[2025-10-29T01:54:57.840+0000] {logging_mixin.py:154} WARNING - Best trial: 23. Best value: 0.797222:  83%|########3 | 25/30 [54:18<18:48, 225.70s/it]
[2025-10-29T01:54:57.840+0000] {logging_mixin.py:154} WARNING - Best trial: 23. Best value: 0.797222:  83%|########3 | 25/30 [54:18<18:48, 225.70s/it]
[2025-10-29T01:54:57.840+0000] {logging_mixin.py:154} WARNING - Best trial: 23. Best value: 0.797222:  87%|########6 | 26/30 [54:18<11:22, 170.51s/it]
[2025-10-29T01:57:05.683+0000] {logging_mixin.py:154} WARNING -                                                                                       
[2025-10-29T01:57:05.687+0000] {logging_mixin.py:154} WARNING - 
[2025-10-29T01:57:05.687+0000] {logging_mixin.py:154} INFO - [I 2025-10-29 01:57:05,676] Trial 26 finished with value: 0.7727302141978905 and parameters: {'model': 'gradient_boosting', 'n_estimators': 181, 'max_depth': 7, 'learning_rate': 0.20839449343062377, 'subsample': 0.9841475648740664}. Best is trial 23 with value: 0.7972224858435355.
[2025-10-29T01:57:05.688+0000] {logging_mixin.py:154} WARNING - Best trial: 23. Best value: 0.797222:  87%|########6 | 26/30 [56:26<11:22, 170.51s/it]
[2025-10-29T01:57:05.688+0000] {logging_mixin.py:154} WARNING - Best trial: 23. Best value: 0.797222:  87%|########6 | 26/30 [56:26<11:22, 170.51s/it]
[2025-10-29T01:57:05.689+0000] {logging_mixin.py:154} WARNING - Best trial: 23. Best value: 0.797222:  90%|######### | 27/30 [56:26<07:53, 157.71s/it]
[2025-10-29T02:00:40.124+0000] {logging_mixin.py:154} WARNING -                                                                                       
[2025-10-29T02:00:40.128+0000] {logging_mixin.py:154} WARNING - 
[2025-10-29T02:00:40.129+0000] {logging_mixin.py:154} INFO - [I 2025-10-29 02:00:40,112] Trial 27 finished with value: 0.7952078348097555 and parameters: {'model': 'gradient_boosting', 'n_estimators': 214, 'max_depth': 9, 'learning_rate': 0.20283224208735676, 'subsample': 0.8220876404824892}. Best is trial 23 with value: 0.7972224858435355.
[2025-10-29T02:00:40.131+0000] {logging_mixin.py:154} WARNING - Best trial: 23. Best value: 0.797222:  90%|######### | 27/30 [1:00:01<07:53, 157.71s/it]
[2025-10-29T02:00:40.131+0000] {logging_mixin.py:154} WARNING - Best trial: 23. Best value: 0.797222:  90%|######### | 27/30 [1:00:01<07:53, 157.71s/it]
[2025-10-29T02:00:40.131+0000] {logging_mixin.py:154} WARNING - Best trial: 23. Best value: 0.797222:  93%|#########3| 28/30 [1:00:01<05:49, 174.73s/it]
[2025-10-29T02:01:38.261+0000] {logging_mixin.py:154} WARNING -                                                                                         
[2025-10-29T02:01:38.263+0000] {logging_mixin.py:154} WARNING - 
[2025-10-29T02:01:38.263+0000] {logging_mixin.py:154} INFO - [I 2025-10-29 02:01:38,260] Trial 28 finished with value: 0.698795594728794 and parameters: {'model': 'gradient_boosting', 'n_estimators': 215, 'max_depth': 3, 'learning_rate': 0.21170304741193263, 'subsample': 0.8213969623820128}. Best is trial 23 with value: 0.7972224858435355.
[2025-10-29T02:01:38.264+0000] {logging_mixin.py:154} WARNING - Best trial: 23. Best value: 0.797222:  93%|#########3| 28/30 [1:00:59<05:49, 174.73s/it]
[2025-10-29T02:01:38.264+0000] {logging_mixin.py:154} WARNING - Best trial: 23. Best value: 0.797222:  93%|#########3| 28/30 [1:00:59<05:49, 174.73s/it]
[2025-10-29T02:01:38.264+0000] {logging_mixin.py:154} WARNING - Best trial: 23. Best value: 0.797222:  97%|#########6| 29/30 [1:00:59<02:19, 139.75s/it]
[2025-10-29T02:03:28.862+0000] {logging_mixin.py:154} WARNING -                                                                                         
[2025-10-29T02:03:28.864+0000] {logging_mixin.py:154} WARNING - 
[2025-10-29T02:03:28.864+0000] {logging_mixin.py:154} INFO - [I 2025-10-29 02:03:28,856] Trial 29 finished with value: 0.7783031004760067 and parameters: {'model': 'gradient_boosting', 'n_estimators': 132, 'max_depth': 8, 'learning_rate': 0.21389137510550715, 'subsample': 0.8988058933898231}. Best is trial 23 with value: 0.7972224858435355.
[2025-10-29T02:03:28.865+0000] {logging_mixin.py:154} WARNING - Best trial: 23. Best value: 0.797222:  97%|#########6| 29/30 [1:02:49<02:19, 139.75s/it]
[2025-10-29T02:03:28.865+0000] {logging_mixin.py:154} WARNING - Best trial: 23. Best value: 0.797222:  97%|#########6| 29/30 [1:02:49<02:19, 139.75s/it]
[2025-10-29T02:03:28.865+0000] {logging_mixin.py:154} WARNING - Best trial: 23. Best value: 0.797222: 100%|##########| 30/30 [1:02:49<00:00, 131.00s/it]
[2025-10-29T02:03:28.867+0000] {logging_mixin.py:154} WARNING - Best trial: 23. Best value: 0.797222: 100%|##########| 30/30 [1:02:49<00:00, 125.66s/it]
[2025-10-29T02:03:28.872+0000] {model_training.py:116} INFO - Mejor F1-Score encontrado: 0.7972
[2025-10-29T02:03:28.873+0000] {model_training.py:117} INFO - Mejores hiperparámetros: {'model': 'gradient_boosting', 'n_estimators': 271, 'max_depth': 9, 'learning_rate': 0.18453007426617202, 'subsample': 0.8572838286849552}
[2025-10-29T02:03:28.874+0000] {model_training.py:204} INFO - Entrenando modelo final con mejores hiperparámetros...
[2025-10-29T02:08:04.509+0000] {model_training.py:236} INFO - Métricas del modelo - Test F1: 0.7985, Test ROC-AUC: 0.9330
[2025-10-29T02:08:04.560+0000] {model_training.py:132} INFO - Generando gráficos de interpretabilidad con SHAP...
[2025-10-29T02:08:10.953+0000] {model_training.py:159} INFO - Gráficos SHAP generados exitosamente
[2025-10-29T02:08:14.576+0000] {logging_mixin.py:154} WARNING - /home/***/.local/lib/python3.10/site-packages/_distutils_hack/__init__.py:33 UserWarning: Setuptools is replacing distutils.
[2025-10-29T02:08:14.807+0000] {model_training.py:283} INFO - Entrenamiento completado exitosamente
[2025-10-29T02:08:14.904+0000] {python.py:194} INFO - Done. Returned value was: {'status': 'success', 'model_type': 'gradient_boosting', 'metrics': {'train_accuracy': 0.8767454090034735, 'train_f1': 0.8193328307194028, 'val_accuracy': 0.8624107978946689, 'val_f1': 0.7978940378504007, 'test_accuracy': 0.8625184324109055, 'test_precision': 0.7805254070054267, 'test_recall': 0.8173980432044948, 'test_f1': 0.7985363006892636, 'test_roc_auc': 0.9330393790694361}}
[2025-10-29T02:08:14.957+0000] {taskinstance.py:1400} INFO - Marking task as SUCCESS. dag_id=sodai_drinks_production_pipeline, task_id=train_model, execution_date=20251019T000000, start_date=20251029T010027, end_date=20251029T020814
[2025-10-29T02:08:15.113+0000] {local_task_job_runner.py:228} INFO - Task exited with return code 0
[2025-10-29T02:08:15.280+0000] {taskinstance.py:2778} INFO - 0 downstream tasks scheduled from follow-on schedule check
