[2025-10-28T23:45:28.816+0000] {logging_mixin.py:154} INFO - [I 2025-10-28 23:45:28,816] Trial 13 pruned. 
[2025-10-28T23:45:28.816+0000] {logging_mixin.py:154} WARNING -  43%|####3     | 13/30 [00:05<00:04,  3.43it/s]
[2025-10-28T23:45:29.073+0000] {model_training.py:107} WARNING - Error al entrenar modelo random_forest: could not convert string to float: 'Brand 7'
[2025-10-28T23:45:29.074+0000] {logging_mixin.py:154} WARNING -                                                
[2025-10-28T23:45:29.074+0000] {logging_mixin.py:154} WARNING - 
[2025-10-28T23:45:29.074+0000] {logging_mixin.py:154} INFO - [I 2025-10-28 23:45:29,074] Trial 14 pruned. 
[2025-10-28T23:45:29.074+0000] {logging_mixin.py:154} WARNING -  47%|####6     | 14/30 [00:05<00:04,  3.43it/s]
[2025-10-28T23:45:29.074+0000] {logging_mixin.py:154} WARNING -  50%|#####     | 15/30 [00:05<00:03,  4.17it/s]
[2025-10-28T23:45:29.701+0000] {model_training.py:107} WARNING - Error al entrenar modelo gradient_boosting: could not convert string to float: 'Brand 7'
[2025-10-28T23:45:29.702+0000] {logging_mixin.py:154} WARNING -                                                
[2025-10-28T23:45:29.703+0000] {logging_mixin.py:154} WARNING - 
[2025-10-28T23:45:29.703+0000] {logging_mixin.py:154} INFO - [I 2025-10-28 23:45:29,702] Trial 15 pruned. 
[2025-10-28T23:45:29.703+0000] {logging_mixin.py:154} WARNING -  50%|#####     | 15/30 [00:05<00:03,  4.17it/s]
[2025-10-28T23:45:29.703+0000] {logging_mixin.py:154} WARNING -  53%|#####3    | 16/30 [00:05<00:04,  3.16it/s]
[2025-10-28T23:45:29.735+0000] {model_training.py:107} WARNING - Error al entrenar modelo xgboost: DataFrame.dtypes for data must be int, float, bool or category. When categorical type is supplied, The experimental DMatrix parameter`enable_categorical` must be set to `True`.  Invalid columns:brand: object
[2025-10-28T23:45:29.736+0000] {logging_mixin.py:154} WARNING -                                                
[2025-10-28T23:45:29.736+0000] {logging_mixin.py:154} WARNING - 
[2025-10-28T23:45:29.736+0000] {logging_mixin.py:154} INFO - [I 2025-10-28 23:45:29,736] Trial 16 pruned. 
[2025-10-28T23:45:29.736+0000] {logging_mixin.py:154} WARNING -  53%|#####3    | 16/30 [00:05<00:04,  3.16it/s]
[2025-10-28T23:45:29.758+0000] {model_training.py:107} WARNING - Error al entrenar modelo xgboost: DataFrame.dtypes for data must be int, float, bool or category. When categorical type is supplied, The experimental DMatrix parameter`enable_categorical` must be set to `True`.  Invalid columns:brand: object
[2025-10-28T23:45:30.627+0000] {logging_mixin.py:154} WARNING -                                                
[2025-10-28T23:45:30.631+0000] {logging_mixin.py:154} WARNING - 
[2025-10-28T23:45:30.632+0000] {logging_mixin.py:154} INFO - [I 2025-10-28 23:45:30,622] Trial 17 pruned. 
[2025-10-28T23:45:30.632+0000] {logging_mixin.py:154} WARNING -  57%|#####6    | 17/30 [00:06<00:04,  3.16it/s]
[2025-10-28T23:45:30.633+0000] {logging_mixin.py:154} WARNING -  60%|######    | 18/30 [00:06<00:04,  2.70it/s]
[2025-10-28T23:45:30.976+0000] {model_training.py:107} WARNING - Error al entrenar modelo gradient_boosting: could not convert string to float: 'Brand 7'
[2025-10-28T23:45:30.977+0000] {logging_mixin.py:154} WARNING -                                                
[2025-10-28T23:45:30.977+0000] {logging_mixin.py:154} WARNING - 
[2025-10-28T23:45:30.977+0000] {logging_mixin.py:154} INFO - [I 2025-10-28 23:45:30,977] Trial 18 pruned. 
[2025-10-28T23:45:30.977+0000] {logging_mixin.py:154} WARNING -  60%|######    | 18/30 [00:07<00:04,  2.70it/s]
[2025-10-28T23:45:30.977+0000] {logging_mixin.py:154} WARNING -  63%|######3   | 19/30 [00:07<00:04,  2.74it/s]
[2025-10-28T23:45:31.731+0000] {model_training.py:107} WARNING - Error al entrenar modelo random_forest: could not convert string to float: 'Brand 7'
[2025-10-28T23:45:31.741+0000] {logging_mixin.py:154} WARNING -                                                
[2025-10-28T23:45:31.741+0000] {logging_mixin.py:154} WARNING - 
[2025-10-28T23:45:31.741+0000] {logging_mixin.py:154} INFO - [I 2025-10-28 23:45:31,738] Trial 19 pruned. 
[2025-10-28T23:45:31.742+0000] {logging_mixin.py:154} WARNING -  63%|######3   | 19/30 [00:07<00:04,  2.74it/s]
[2025-10-28T23:45:31.742+0000] {logging_mixin.py:154} WARNING -  67%|######6   | 20/30 [00:07<00:04,  2.20it/s]
[2025-10-28T23:45:32.153+0000] {model_training.py:107} WARNING - Error al entrenar modelo gradient_boosting: could not convert string to float: 'Brand 7'
[2025-10-28T23:45:32.154+0000] {logging_mixin.py:154} WARNING -                                                
[2025-10-28T23:45:32.154+0000] {logging_mixin.py:154} WARNING - 
[2025-10-28T23:45:32.154+0000] {logging_mixin.py:154} INFO - [I 2025-10-28 23:45:32,154] Trial 20 pruned. 
[2025-10-28T23:45:32.154+0000] {logging_mixin.py:154} WARNING -  67%|######6   | 20/30 [00:08<00:04,  2.20it/s]
[2025-10-28T23:45:32.154+0000] {logging_mixin.py:154} WARNING -  70%|#######   | 21/30 [00:08<00:04,  2.25it/s]
[2025-10-28T23:45:33.478+0000] {local_task_job_runner.py:228} INFO - Task exited with return code -9
[2025-10-28T23:45:33.531+0000] {taskinstance.py:2778} INFO - 0 downstream tasks scheduled from follow-on schedule check
[2025-10-29T01:00:27.784+0000] {taskinstance.py:1159} INFO - Dependencies all met for dep_context=non-requeueable deps ti=<TaskInstance: sodai_drinks_production_pipeline.train_model scheduled__2025-10-19T00:00:00+00:00 [queued]>
[2025-10-29T01:00:27.826+0000] {taskinstance.py:1159} INFO - Dependencies all met for dep_context=requeueable deps ti=<TaskInstance: sodai_drinks_production_pipeline.train_model scheduled__2025-10-19T00:00:00+00:00 [queued]>
[2025-10-29T01:00:27.827+0000] {taskinstance.py:1361} INFO - Starting attempt 1 of 2
[2025-10-29T01:00:27.910+0000] {taskinstance.py:1382} INFO - Executing <Task(PythonOperator): train_model> on 2025-10-19 00:00:00+00:00
[2025-10-29T01:00:28.202+0000] {standard_task_runner.py:57} INFO - Started process 392 to run task
[2025-10-29T01:00:28.415+0000] {standard_task_runner.py:84} INFO - Running: ['***', 'tasks', 'run', 'sodai_drinks_production_pipeline', 'train_model', 'scheduled__2025-10-19T00:00:00+00:00', '--job-id', '119', '--raw', '--subdir', 'DAGS_FOLDER/pipeline_productivo.py', '--cfg-path', '/tmp/tmpc6g315s7']
[2025-10-29T01:00:28.580+0000] {standard_task_runner.py:85} INFO - Job 119: Subtask train_model
[2025-10-29T01:00:29.142+0000] {task_command.py:416} INFO - Running <TaskInstance: sodai_drinks_production_pipeline.train_model scheduled__2025-10-19T00:00:00+00:00 [running]> on host ee70ee0df05e
[2025-10-29T01:00:29.391+0000] {taskinstance.py:1662} INFO - Exporting env vars: AIRFLOW_CTX_DAG_EMAIL='team@sodaidrinks.com' AIRFLOW_CTX_DAG_OWNER='sodai_drinks_team' AIRFLOW_CTX_DAG_ID='sodai_drinks_production_pipeline' AIRFLOW_CTX_TASK_ID='train_model' AIRFLOW_CTX_EXECUTION_DATE='2025-10-19T00:00:00+00:00' AIRFLOW_CTX_TRY_NUMBER='1' AIRFLOW_CTX_DAG_RUN_ID='scheduled__2025-10-19T00:00:00+00:00'
[2025-10-29T01:00:29.415+0000] {model_training.py:172} INFO - Iniciando entrenamiento del modelo...
[2025-10-29T01:00:31.677+0000] {model_training.py:187} INFO - Features: 15, Registros: 619380
[2025-10-29T01:00:31.703+0000] {model_training.py:188} INFO - Distribución de clases - 0: 412920, 1: 206460
[2025-10-29T01:00:38.667+0000] {logging_mixin.py:154} WARNING - 2025/10/29 01:00:38 WARNING mlflow.utils.git_utils: Failed to import Git (the Git executable is probably not on your PATH), so Git SHA is not available. Error: Failed to initialize: Bad git executable.
The git executable must be specified in one of the following ways:
    - be included in your $PATH
    - be set via $GIT_PYTHON_GIT_EXECUTABLE
    - explicitly set via git.refresh(<full-path-to-git-executable>)

All git commands will error until this is rectified.

This initial message can be silenced or aggravated in the future by setting the
$GIT_PYTHON_REFRESH environment variable. Use one of the following values:
    - quiet|q|silence|s|silent|none|n|0: for no message or exception
    - warn|w|warning|log|l|1: for a warning message (logging level CRITICAL, displayed by default)
    - error|e|exception|raise|r|2: for a raised exception

Example:
    export GIT_PYTHON_REFRESH=quiet
[2025-10-29T01:00:38.825+0000] {model_training.py:56} INFO - Iniciando optimización de hiperparámetros con 30 trials...
[2025-10-29T01:00:39.057+0000] {logging_mixin.py:154} WARNING -   0%|          | 0/30 [00:00<?, ?it/s]
[2025-10-29T01:03:32.444+0000] {logging_mixin.py:154} WARNING -                                       
[2025-10-29T01:03:32.479+0000] {logging_mixin.py:154} WARNING - 
[2025-10-29T01:03:32.479+0000] {logging_mixin.py:154} INFO - [I 2025-10-29 01:03:32,412] Trial 0 finished with value: 0.7211903470715836 and parameters: {'model': 'gradient_boosting', 'n_estimators': 162, 'max_depth': 8, 'learning_rate': 0.038911692721065254, 'subsample': 0.9109036551364372}. Best is trial 0 with value: 0.7211903470715836.
[2025-10-29T01:03:32.485+0000] {logging_mixin.py:154} WARNING -   0%|          | 0/30 [02:53<?, ?it/s]
[2025-10-29T01:03:32.488+0000] {logging_mixin.py:154} WARNING - Best trial: 0. Best value: 0.72119:   0%|          | 0/30 [02:53<?, ?it/s]
[2025-10-29T01:03:32.489+0000] {logging_mixin.py:154} WARNING - Best trial: 0. Best value: 0.72119:   3%|3         | 1/30 [02:53<1:23:49, 173.42s/it]
[2025-10-29T01:04:07.608+0000] {logging_mixin.py:154} WARNING -                                                                                      
[2025-10-29T01:04:07.610+0000] {logging_mixin.py:154} WARNING - 
[2025-10-29T01:04:07.610+0000] {logging_mixin.py:154} INFO - [I 2025-10-29 01:04:07,606] Trial 1 finished with value: 0.725199045923338 and parameters: {'model': 'gradient_boosting', 'n_estimators': 82, 'max_depth': 5, 'learning_rate': 0.29179603613602456, 'subsample': 0.9395776885497541}. Best is trial 1 with value: 0.725199045923338.
[2025-10-29T01:04:07.611+0000] {logging_mixin.py:154} WARNING - Best trial: 0. Best value: 0.72119:   3%|3         | 1/30 [03:28<1:23:49, 173.42s/it]
[2025-10-29T01:04:07.612+0000] {logging_mixin.py:154} WARNING - Best trial: 1. Best value: 0.725199:   3%|3         | 1/30 [03:28<1:23:49, 173.42s/it]
[2025-10-29T01:04:07.612+0000] {logging_mixin.py:154} WARNING - Best trial: 1. Best value: 0.725199:   7%|6         | 2/30 [03:28<42:57, 92.07s/it]   
[2025-10-29T01:04:22.143+0000] {logging_mixin.py:154} WARNING -                                                                                    
[2025-10-29T01:04:22.146+0000] {logging_mixin.py:154} WARNING - 
[2025-10-29T01:04:22.146+0000] {logging_mixin.py:154} INFO - [I 2025-10-29 01:04:22,142] Trial 2 finished with value: 0.6723652521963298 and parameters: {'model': 'random_forest', 'n_estimators': 106, 'max_depth': 10, 'min_samples_split': 18, 'min_samples_leaf': 2}. Best is trial 1 with value: 0.725199045923338.
[2025-10-29T01:04:22.147+0000] {logging_mixin.py:154} WARNING - Best trial: 1. Best value: 0.725199:   7%|6         | 2/30 [03:43<42:57, 92.07s/it]
[2025-10-29T01:04:22.148+0000] {logging_mixin.py:154} WARNING - Best trial: 1. Best value: 0.725199:   7%|6         | 2/30 [03:43<42:57, 92.07s/it]
[2025-10-29T01:04:22.148+0000] {logging_mixin.py:154} WARNING - Best trial: 1. Best value: 0.725199:  10%|#         | 3/30 [03:43<25:29, 56.67s/it]
[2025-10-29T01:04:24.685+0000] {logging_mixin.py:154} WARNING -                                                                                    
[2025-10-29T01:04:24.686+0000] {logging_mixin.py:154} WARNING - 
[2025-10-29T01:04:24.686+0000] {logging_mixin.py:154} INFO - [I 2025-10-29 01:04:24,685] Trial 3 finished with value: 0.751512384431001 and parameters: {'model': 'xgboost', 'n_estimators': 260, 'max_depth': 5, 'learning_rate': 0.29708671023643907, 'subsample': 0.7651398509730318, 'colsample_bytree': 0.6848909624756827}. Best is trial 3 with value: 0.751512384431001.
[2025-10-29T01:04:24.686+0000] {logging_mixin.py:154} WARNING - Best trial: 1. Best value: 0.725199:  10%|#         | 3/30 [03:45<25:29, 56.67s/it]
[2025-10-29T01:04:24.686+0000] {logging_mixin.py:154} WARNING - Best trial: 3. Best value: 0.751512:  10%|#         | 3/30 [03:45<25:29, 56.67s/it]
[2025-10-29T01:04:24.687+0000] {logging_mixin.py:154} WARNING - Best trial: 3. Best value: 0.751512:  13%|#3        | 4/30 [03:45<15:17, 35.30s/it]
[2025-10-29T01:04:37.630+0000] {logging_mixin.py:154} WARNING -                                                                                    
[2025-10-29T01:04:37.632+0000] {logging_mixin.py:154} WARNING - 
[2025-10-29T01:04:37.632+0000] {logging_mixin.py:154} INFO - [I 2025-10-29 01:04:37,629] Trial 4 finished with value: 0.7511665618691464 and parameters: {'model': 'random_forest', 'n_estimators': 56, 'max_depth': 20, 'min_samples_split': 17, 'min_samples_leaf': 7}. Best is trial 3 with value: 0.751512384431001.
[2025-10-29T01:04:37.632+0000] {logging_mixin.py:154} WARNING - Best trial: 3. Best value: 0.751512:  13%|#3        | 4/30 [03:58<15:17, 35.30s/it]
[2025-10-29T01:04:37.633+0000] {logging_mixin.py:154} WARNING - Best trial: 3. Best value: 0.751512:  13%|#3        | 4/30 [03:58<15:17, 35.30s/it]
[2025-10-29T01:04:37.633+0000] {logging_mixin.py:154} WARNING - Best trial: 3. Best value: 0.751512:  17%|#6        | 5/30 [03:58<11:20, 27.24s/it]
[2025-10-29T01:05:59.817+0000] {logging_mixin.py:154} WARNING -                                                                                    
[2025-10-29T01:05:59.822+0000] {logging_mixin.py:154} WARNING - 
[2025-10-29T01:05:59.823+0000] {logging_mixin.py:154} INFO - [I 2025-10-29 01:05:59,806] Trial 5 finished with value: 0.7227789587340148 and parameters: {'model': 'gradient_boosting', 'n_estimators': 290, 'max_depth': 4, 'learning_rate': 0.14115912791860513, 'subsample': 0.7925959380068821}. Best is trial 3 with value: 0.751512384431001.
[2025-10-29T01:05:59.825+0000] {logging_mixin.py:154} WARNING - Best trial: 3. Best value: 0.751512:  17%|#6        | 5/30 [05:20<11:20, 27.24s/it]
[2025-10-29T01:05:59.826+0000] {logging_mixin.py:154} WARNING - Best trial: 3. Best value: 0.751512:  17%|#6        | 5/30 [05:20<11:20, 27.24s/it]
[2025-10-29T01:05:59.826+0000] {logging_mixin.py:154} WARNING - Best trial: 3. Best value: 0.751512:  20%|##        | 6/30 [05:20<18:22, 45.92s/it]
[2025-10-29T01:06:16.279+0000] {logging_mixin.py:154} WARNING -                                                                                    
[2025-10-29T01:06:16.281+0000] {logging_mixin.py:154} WARNING - 
[2025-10-29T01:06:16.281+0000] {logging_mixin.py:154} INFO - [I 2025-10-29 01:06:16,276] Trial 6 finished with value: 0.5232240701659278 and parameters: {'model': 'random_forest', 'n_estimators': 141, 'max_depth': 5, 'min_samples_split': 11, 'min_samples_leaf': 5}. Best is trial 3 with value: 0.751512384431001.
[2025-10-29T01:06:16.282+0000] {logging_mixin.py:154} WARNING - Best trial: 3. Best value: 0.751512:  20%|##        | 6/30 [05:37<18:22, 45.92s/it]
[2025-10-29T01:06:16.283+0000] {logging_mixin.py:154} WARNING - Best trial: 3. Best value: 0.751512:  20%|##        | 6/30 [05:37<18:22, 45.92s/it]
[2025-10-29T01:06:16.283+0000] {logging_mixin.py:154} WARNING - Best trial: 3. Best value: 0.751512:  23%|##3       | 7/30 [05:37<13:54, 36.29s/it]
[2025-10-29T01:06:18.758+0000] {logging_mixin.py:154} WARNING -                                                                                    
[2025-10-29T01:06:18.759+0000] {logging_mixin.py:154} WARNING - 
[2025-10-29T01:06:18.759+0000] {logging_mixin.py:154} INFO - [I 2025-10-29 01:06:18,756] Trial 7 finished with value: 0.7223475537896898 and parameters: {'model': 'xgboost', 'n_estimators': 93, 'max_depth': 6, 'learning_rate': 0.18014411128089533, 'subsample': 0.6228952862902593, 'colsample_bytree': 0.9126231721784194}. Best is trial 3 with value: 0.751512384431001.
[2025-10-29T01:06:18.759+0000] {logging_mixin.py:154} WARNING - Best trial: 3. Best value: 0.751512:  23%|##3       | 7/30 [05:39<13:54, 36.29s/it]
[2025-10-29T01:06:18.760+0000] {logging_mixin.py:154} WARNING - Best trial: 3. Best value: 0.751512:  23%|##3       | 7/30 [05:39<13:54, 36.29s/it]
[2025-10-29T01:06:18.760+0000] {logging_mixin.py:154} WARNING - Best trial: 3. Best value: 0.751512:  27%|##6       | 8/30 [05:39<09:21, 25.53s/it]
[2025-10-29T01:10:37.302+0000] {logging_mixin.py:154} WARNING -                                                                                    
[2025-10-29T01:10:37.306+0000] {logging_mixin.py:154} WARNING - 
[2025-10-29T01:10:37.306+0000] {logging_mixin.py:154} INFO - [I 2025-10-29 01:10:37,296] Trial 8 finished with value: 0.7923824701195219 and parameters: {'model': 'gradient_boosting', 'n_estimators': 246, 'max_depth': 10, 'learning_rate': 0.0883612454732467, 'subsample': 0.6062179966410775}. Best is trial 8 with value: 0.7923824701195219.
[2025-10-29T01:10:37.308+0000] {logging_mixin.py:154} WARNING - Best trial: 3. Best value: 0.751512:  27%|##6       | 8/30 [09:58<09:21, 25.53s/it]
[2025-10-29T01:10:37.309+0000] {logging_mixin.py:154} WARNING - Best trial: 8. Best value: 0.792382:  27%|##6       | 8/30 [09:58<09:21, 25.53s/it]
[2025-10-29T01:10:37.309+0000] {logging_mixin.py:154} WARNING - Best trial: 8. Best value: 0.792382:  30%|###       | 9/30 [09:58<34:25, 98.37s/it]
[2025-10-29T01:10:58.168+0000] {logging_mixin.py:154} WARNING -                                                                                    
[2025-10-29T01:10:58.170+0000] {logging_mixin.py:154} WARNING - 
[2025-10-29T01:10:58.170+0000] {logging_mixin.py:154} INFO - [I 2025-10-29 01:10:58,166] Trial 9 finished with value: 0.6957305239811478 and parameters: {'model': 'gradient_boosting', 'n_estimators': 76, 'max_depth': 4, 'learning_rate': 0.2849492195917336, 'subsample': 0.6745373579362125}. Best is trial 8 with value: 0.7923824701195219.
[2025-10-29T01:10:58.170+0000] {logging_mixin.py:154} WARNING - Best trial: 8. Best value: 0.792382:  30%|###       | 9/30 [10:19<34:25, 98.37s/it]
[2025-10-29T01:10:58.171+0000] {logging_mixin.py:154} WARNING - Best trial: 8. Best value: 0.792382:  30%|###       | 9/30 [10:19<34:25, 98.37s/it]
[2025-10-29T01:10:58.171+0000] {logging_mixin.py:154} WARNING - Best trial: 8. Best value: 0.792382:  33%|###3      | 10/30 [10:19<24:48, 74.44s/it]
[2025-10-29T01:16:07.315+0000] {logging_mixin.py:154} WARNING -                                                                                     
[2025-10-29T01:16:07.329+0000] {logging_mixin.py:154} WARNING - 
[2025-10-29T01:16:07.329+0000] {logging_mixin.py:154} INFO - [I 2025-10-29 01:16:07,297] Trial 10 finished with value: 0.7475794263697207 and parameters: {'model': 'gradient_boosting', 'n_estimators': 225, 'max_depth': 10, 'learning_rate': 0.025005726794818398, 'subsample': 0.669151667337531}. Best is trial 8 with value: 0.7923824701195219.
[2025-10-29T01:16:07.331+0000] {logging_mixin.py:154} WARNING - Best trial: 8. Best value: 0.792382:  33%|###3      | 10/30 [15:28<24:48, 74.44s/it]
[2025-10-29T01:16:07.332+0000] {logging_mixin.py:154} WARNING - Best trial: 8. Best value: 0.792382:  33%|###3      | 10/30 [15:28<24:48, 74.44s/it]
[2025-10-29T01:16:07.333+0000] {logging_mixin.py:154} WARNING - Best trial: 8. Best value: 0.792382:  37%|###6      | 11/30 [15:28<46:19, 146.28s/it]
[2025-10-29T01:16:14.314+0000] {logging_mixin.py:154} WARNING -                                                                                      
[2025-10-29T01:16:14.318+0000] {logging_mixin.py:154} WARNING - 
[2025-10-29T01:16:14.319+0000] {logging_mixin.py:154} INFO - [I 2025-10-29 01:16:14,313] Trial 11 finished with value: 0.7627173630936933 and parameters: {'model': 'xgboost', 'n_estimators': 241, 'max_depth': 8, 'learning_rate': 0.12264606706664644, 'subsample': 0.7588305737573218, 'colsample_bytree': 0.631606119876093}. Best is trial 8 with value: 0.7923824701195219.
[2025-10-29T01:16:14.319+0000] {logging_mixin.py:154} WARNING - Best trial: 8. Best value: 0.792382:  37%|###6      | 11/30 [15:35<46:19, 146.28s/it]
[2025-10-29T01:16:14.320+0000] {logging_mixin.py:154} WARNING - Best trial: 8. Best value: 0.792382:  37%|###6      | 11/30 [15:35<46:19, 146.28s/it]
[2025-10-29T01:16:14.320+0000] {logging_mixin.py:154} WARNING - Best trial: 8. Best value: 0.792382:  40%|####      | 12/30 [15:35<31:10, 103.91s/it]
[2025-10-29T01:16:19.219+0000] {logging_mixin.py:154} WARNING -                                                                                      
[2025-10-29T01:16:19.221+0000] {logging_mixin.py:154} WARNING - 
[2025-10-29T01:16:19.222+0000] {logging_mixin.py:154} INFO - [I 2025-10-29 01:16:19,218] Trial 12 finished with value: 0.7647211245708363 and parameters: {'model': 'xgboost', 'n_estimators': 212, 'max_depth': 9, 'learning_rate': 0.10310398168425207, 'subsample': 0.6069994815435831, 'colsample_bytree': 0.6025213259891491}. Best is trial 8 with value: 0.7923824701195219.
[2025-10-29T01:16:19.222+0000] {logging_mixin.py:154} WARNING - Best trial: 8. Best value: 0.792382:  40%|####      | 12/30 [15:40<31:10, 103.91s/it]
[2025-10-29T01:16:19.222+0000] {logging_mixin.py:154} WARNING - Best trial: 8. Best value: 0.792382:  40%|####      | 12/30 [15:40<31:10, 103.91s/it]
[2025-10-29T01:16:19.222+0000] {logging_mixin.py:154} WARNING - Best trial: 8. Best value: 0.792382:  43%|####3     | 13/30 [15:40<20:56, 73.91s/it] 
[2025-10-29T01:16:29.803+0000] {logging_mixin.py:154} WARNING -                                                                                     
[2025-10-29T01:16:29.808+0000] {logging_mixin.py:154} WARNING - 
